{
  "schema_version": 1,
  "event_id": "01a0ec82-72d7-7f23-8be6-203712701f31",
  "kind": "check_in_due",
  "task_id": "01a0ec82-72d7-7f23-8be6-203712701f21",
  "rule": "Coach · check_in_due (25 min cadence)",
  "level": "coach",
  "message": "Still on Write proposal?",
  "fired_at": "2026-03-10T14:25:00Z"
}
